{
  "ir_version": "1.0",
  "compiler_version": "1.1",
  "artifact_type": "search_index",
  "generated_at": "2026-06-25T10:19:35Z",
  "repository_commit": "f95b4fe91f273f7a6745f2f7d1de4733757db2dd",
  "provenance": {
    "artifact_id": "ART-SEARCH-INDEX-00001",
    "produced_by": "Phase0_Discovery",
    "consumes": [],
    "used_by": [
      "docs_renderers",
      "dependency_graph"
    ]
  },
  "data": {
    "psa": [
      "ART-TERM-00517"
    ],
    "party stock account": [
      "ART-TERM-00517",
      "ART-FIELD-00187"
    ],
    "stock account": [
      "ART-TERM-00517"
    ],
    "channel account": [
      "ART-TERM-00517"
    ],
    "party": [
      "ART-TERM-00517",
      "ART-TERM-00518",
      "ART-TERM-00530",
      "ART-FIELD-00183",
      "ART-FIELD-00184",
      "ART-FIELD-00187",
      "ART-DOCTYPE-00059",
      "ART-DOCTYPE-00060",
      "ART-DOCTYPE-00061",
      "ART-DOCTYPE-00062",
      "ART-DOCTYPE-00063",
      "ART-DOCTYPE-00064"
    ],
    "stock": [
      "ART-TERM-00517",
      "ART-TERM-00518",
      "ART-TERM-00523",
      "ART-TERM-00525",
      "ART-TERM-00530",
      "ART-FIELD-00154",
      "ART-FIELD-00183",
      "ART-FIELD-00184",
      "ART-FIELD-00187",
      "ART-DOCTYPE-00005",
      "ART-DOCTYPE-00063",
      "ART-DOCTYPE-00064",
      "ART-SCREEN-INVENTORY",
      "INV-003"
    ],
    "account": [
      "ART-TERM-00517",
      "ART-FIELD-00183",
      "ART-FIELD-00184",
      "ART-FIELD-00187",
      "ART-DOCTYPE-00063"
    ],
    "psv": [
      "ART-TERM-00518",
      "ART-DOCTYPE-00001",
      "ART-DOCTYPE-00002",
      "ART-DOCTYPE-00003",
      "ART-DOCTYPE-00004",
      "ART-DOCTYPE-00005",
      "ART-DOCTYPE-00006",
      "ART-DOCTYPE-00070",
      "ART-DOCTYPE-00071",
      "ART-DOCTYPE-00072",
      "ART-DOCTYPE-00073",
      "ART-DOCTYPE-00074",
      "ART-DOCTYPE-00075",
      "ART-DOCTYPE-00076"
    ],
    "party stock visibility": [
      "ART-TERM-00518"
    ],
    "channel stock visibility": [
      "ART-TERM-00518"
    ],
    "partner stock": [
      "ART-TERM-00518"
    ],
    "visibility": [
      "ART-TERM-00518"
    ],
    "pdt": [
      "ART-TERM-00519"
    ],
    "predictive distribution twin": [
      "ART-TERM-00519"
    ],
    "replenishment engine": [
      "ART-TERM-00519"
    ],
    "stock planner": [
      "ART-TERM-00519"
    ],
    "predictive": [
      "ART-TERM-00519"
    ],
    "distribution": [
      "ART-TERM-00519"
    ],
    "twin": [
      "ART-TERM-00519",
      "ART-DOCTYPE-00087"
    ],
    "woc": [
      "ART-TERM-00520"
    ],
    "weeks of cover": [
      "ART-TERM-00520"
    ],
    "inventory coverage": [
      "ART-TERM-00520"
    ],
    "stock cover": [
      "ART-TERM-00520"
    ],
    "weeks": [
      "ART-TERM-00520",
      "INV-002"
    ],
    "of": [
      "ART-TERM-00520",
      "INV-002"
    ],
    "cover": [
      "ART-TERM-00520",
      "INV-002"
    ],
    "sales velocity": [
      "ART-TERM-00521",
      "INV-001"
    ],
    "velocity": [
      "ART-TERM-00521",
      "INV-001"
    ],
    "weekly sales rate": [
      "ART-TERM-00521"
    ],
    "sales": [
      "ART-TERM-00521",
      "ART-DOCTYPE-00061",
      "ART-DOCTYPE-00062",
      "ART-DOCTYPE-00083",
      "ART-DOCTYPE-00084",
      "INV-001"
    ],
    "forecast confidence": [
      "ART-TERM-00522"
    ],
    "forecast confidence score": [
      "ART-TERM-00522"
    ],
    "confidence score": [
      "ART-TERM-00522"
    ],
    "forecasting reliability": [
      "ART-TERM-00522"
    ],
    "forecast": [
      "ART-TERM-00522"
    ],
    "confidence": [
      "ART-TERM-00522"
    ],
    "score": [
      "ART-TERM-00522",
      "ART-TERM-00523",
      "ART-TERM-00525",
      "ART-TERM-00527",
      "ART-TERM-00528",
      "ART-FIELD-00171",
      "ART-FIELD-00172",
      "INV-003"
    ],
    "dead stock": [
      "ART-TERM-00523"
    ],
    "dead stock score": [
      "ART-TERM-00523",
      "INV-003"
    ],
    "liquidation score": [
      "ART-TERM-00523"
    ],
    "slow moving stock": [
      "ART-TERM-00523"
    ],
    "dead": [
      "ART-TERM-00523",
      "INV-003"
    ],
    "sell through": [
      "ART-TERM-00524"
    ],
    "sell through percentage": [
      "ART-TERM-00524"
    ],
    "sell through %": [
      "ART-TERM-00524"
    ],
    "st%": [
      "ART-TERM-00524"
    ],
    "sell": [
      "ART-TERM-00524"
    ],
    "through": [
      "ART-TERM-00524"
    ],
    "percentage": [
      "ART-TERM-00524",
      "ART-FIELD-00151"
    ],
    "stock accuracy": [
      "ART-TERM-00525"
    ],
    "stock accuracy score": [
      "ART-TERM-00525"
    ],
    "audit score": [
      "ART-TERM-00525"
    ],
    "inventory accuracy": [
      "ART-TERM-00525"
    ],
    "accuracy": [
      "ART-TERM-00525"
    ],
    "inventory turnover": [
      "ART-TERM-00526"
    ],
    "inventory turnover ratio": [
      "ART-TERM-00526"
    ],
    "turnover ratio": [
      "ART-TERM-00526"
    ],
    "itr": [
      "ART-TERM-00526"
    ],
    "inventory": [
      "ART-TERM-00526",
      "ART-TERM-00529",
      "ART-SCREEN-INVENTORY"
    ],
    "turnover": [
      "ART-TERM-00526"
    ],
    "ratio": [
      "ART-TERM-00526"
    ],
    "outlet health score": [
      "ART-TERM-00527"
    ],
    "ohs": [
      "ART-TERM-00527"
    ],
    "store health": [
      "ART-TERM-00527"
    ],
    "outlet": [
      "ART-TERM-00527"
    ],
    "health": [
      "ART-TERM-00527"
    ],
    "transfer benefit score": [
      "ART-TERM-00528"
    ],
    "tbs": [
      "ART-TERM-00528"
    ],
    "transfer optimization": [
      "ART-TERM-00528"
    ],
    "transfer": [
      "ART-TERM-00528"
    ],
    "benefit": [
      "ART-TERM-00528",
      "ART-DOCTYPE-00011",
      "ART-DOCTYPE-00012",
      "ART-DOCTYPE-00013",
      "ART-DOCTYPE-00014",
      "ART-DOCTYPE-00015",
      "ART-DOCTYPE-00016",
      "ART-DOCTYPE-00017",
      "ART-DOCTYPE-00018",
      "ART-DOCTYPE-00033"
    ],
    "physical snapshot": [
      "ART-TERM-00529"
    ],
    "physical inventory snapshot": [
      "ART-TERM-00529"
    ],
    "audit snapshot": [
      "ART-TERM-00529"
    ],
    "stock freeze": [
      "ART-TERM-00529"
    ],
    "physical": [
      "ART-TERM-00529",
      "ART-DOCTYPE-00059",
      "ART-DOCTYPE-00060"
    ],
    "snapshot": [
      "ART-TERM-00529",
      "ART-DOCTYPE-00005",
      "ART-DOCTYPE-00015",
      "ART-DOCTYPE-00048",
      "ART-DOCTYPE-00060",
      "ART-DOCTYPE-00083",
      "ART-DOCTYPE-00098"
    ],
    "party stock ledger": [
      "ART-TERM-00530"
    ],
    "psl": [
      "ART-TERM-00530"
    ],
    "channel ledger": [
      "ART-TERM-00530"
    ],
    "ledger": [
      "ART-TERM-00530",
      "ART-DOCTYPE-00003",
      "ART-DOCTYPE-00009",
      "ART-DOCTYPE-00014",
      "ART-DOCTYPE-00026",
      "ART-DOCTYPE-00064",
      "ART-DOCTYPE-00097"
    ],
    "reorder suggestion": [
      "ART-TERM-00531"
    ],
    "reorder recs": [
      "ART-TERM-00531"
    ],
    "replenishment qty": [
      "ART-TERM-00531"
    ],
    "reorder": [
      "ART-TERM-00531",
      "ART-DOCTYPE-00004",
      "ART-DOCTYPE-00073"
    ],
    "suggestion": [
      "ART-TERM-00531"
    ],
    "stockout risk": [
      "ART-TERM-00532"
    ],
    "stockout risk index": [
      "ART-TERM-00532"
    ],
    "out of stock risk": [
      "ART-TERM-00532"
    ],
    "sor": [
      "ART-TERM-00532"
    ],
    "stockout": [
      "ART-TERM-00532"
    ],
    "risk": [
      "ART-TERM-00532"
    ],
    "index": [
      "ART-TERM-00532"
    ],
    "variant curve": [
      "ART-TERM-00533"
    ],
    "variant size curve": [
      "ART-TERM-00533"
    ],
    "size curve": [
      "ART-TERM-00533"
    ],
    "size ratio": [
      "ART-TERM-00533"
    ],
    "variant": [
      "ART-TERM-00533"
    ],
    "size": [
      "ART-TERM-00533",
      "ART-FIELD-00139",
      "ART-FIELD-00099"
    ],
    "curve": [
      "ART-TERM-00533"
    ],
    "ema": [
      "ART-TERM-00534"
    ],
    "exponential moving average": [
      "ART-TERM-00534"
    ],
    "exponential average": [
      "ART-TERM-00534"
    ],
    "weighted average": [
      "ART-TERM-00534"
    ],
    "exponential": [
      "ART-TERM-00534"
    ],
    "moving": [
      "ART-TERM-00534"
    ],
    "average": [
      "ART-TERM-00534"
    ],
    "seasonality factor": [
      "ART-TERM-00535"
    ],
    "seasonality index": [
      "ART-TERM-00535"
    ],
    "seasonal index": [
      "ART-TERM-00535"
    ],
    "seasonality": [
      "ART-TERM-00535"
    ],
    "factor": [
      "ART-TERM-00535"
    ],
    "lead time": [
      "ART-TERM-00536"
    ],
    "supplier lead time": [
      "ART-TERM-00536"
    ],
    "po to grn time": [
      "ART-TERM-00536"
    ],
    "supplier": [
      "ART-TERM-00536"
    ],
    "lead": [
      "ART-TERM-00536",
      "ART-DOCTYPE-00092"
    ],
    "time": [
      "ART-TERM-00536",
      "ART-FIELD-00145"
    ],
    "custom_business_type": [
      "ART-FIELD-00134"
    ],
    "business_type": [
      "ART-FIELD-00134"
    ],
    "business type": [
      "ART-FIELD-00134"
    ],
    "business": [
      "ART-FIELD-00134",
      "ART-DOCTYPE-00019"
    ],
    "type": [
      "ART-FIELD-00134",
      "ART-FIELD-00161",
      "ART-FIELD-00191",
      "ART-DOCTYPE-00013",
      "ART-DOCTYPE-00044"
    ],
    "custom_print_profiles_json": [
      "ART-FIELD-00135"
    ],
    "print_profiles_json": [
      "ART-FIELD-00135"
    ],
    "print profiles json": [
      "ART-FIELD-00135"
    ],
    "print": [
      "ART-FIELD-00135",
      "ART-DOCTYPE-00065",
      "ART-DOCTYPE-00066",
      "ART-DOCTYPE-00067"
    ],
    "profiles": [
      "ART-FIELD-00135"
    ],
    "json": [
      "ART-FIELD-00135",
      "ART-FIELD-00185"
    ],
    "default_printer_ip": [
      "ART-FIELD-00136"
    ],
    "default printer ip": [
      "ART-FIELD-00136"
    ],
    "default": [
      "ART-FIELD-00136",
      "ART-FIELD-00137",
      "ART-FIELD-00138",
      "ART-FIELD-00139"
    ],
    "printer": [
      "ART-FIELD-00136",